### ISSUE TITLE
tmux delay in tcsh

### ISSUE THREAD

**Issue by survo** [tmux/tmux#485]
new window (Ctrl-b Ctrl-c) appears with a delay in 1-2 seconds (freebsd, tmux 2.1 and 2.2)
and instantly with this:

```
--- configure.orig
+++ configure
@@ -5093,11 +5093,11 @@ else
 fi
 
 
-if test "x$have_utempter" = xyes; then
-       $as_echo "#define HAVE_UTEMPTER 1" >>confdefs.h
-
-       LIBS="$LIBS -lutempter"
-fi
+#if test "x$have_utempter" = xyes; then
+#      $as_echo "#define HAVE_UTEMPTER 1" >>confdefs.h
+#
+#      LIBS="$LIBS -lutempter"
+#fi
 
 # Check for b64_ntop.
 { $as_echo "$as_me:${as_lineno-$LINENO}: checking for b64_ntop" >&5
```

**Comment by nicm** [comment]
I guess something in utempter is broken with tcsh or on FreeBSD.

**Comment by nicm** [comment]
You can build without it with --disable-utempter in Git master (possibly in 2.3 too, I forget).

**Comment by survo** [comment]
It works. Thanks.
With utempter DNS inquiries are sent at each creation of a new window :/

```
11:54:02.328025 IP 192.168.1.88.62735 > 192.168.1.1.domain: 10559+ A? tmux(1146).%2. (31)
11:54:02.436090 IP 192.168.1.1.domain > 192.168.1.88.62735: 10559 NXDomain 0/1/0 (106)
11:54:02.436306 IP 192.168.1.88.56669 > 192.168.1.1.domain: 34379+ AAAA? tmux(1146).%2. (31)
11:54:02.498255 IP 192.168.1.1.domain > 192.168.1.88.56669: 34379 NXDomain 0/1/0 (106)
11:54:02.498447 IP 192.168.1.88.54041 > 192.168.1.1.domain: 35284+ A? tmux(1146).%2.local. (37)
11:54:02.578803 IP 192.168.1.1.domain > 192.168.1.88.54041: 35284 NXDomain 0/1/0 (112)
11:54:02.578937 IP 192.168.1.88.64830 > 192.168.1.1.domain: 5865+ AAAA? tmux(1146).%2.local. (37)
11:54:02.643145 IP 192.168.1.1.domain > 192.168.1.88.64830: 5865 NXDomain 0/1/0 (112)
```

**Comment by nicm** [comment]
This is more likely to be login(3) itself doing this.
